{
  "kind": "publish-receipt",
  "schema_version": 2,
  "example": true,
  "canonicalization": "feltwillow-canonical-json-v1",
  "plan_id": "example-plan-podcast-0001",
  "plan_sha256": "d30508e48a8c974a7ffeddc090c0572520bad1445ba060357ab96f2777807aa3",
  "action_id": "upload-episode",
  "operation": "manual-upload",
  "result": "manual_pending",
  "observed_at": "2026-10-07T10:05:00Z",
  "external_id": null,
  "external_url": null,
  "observation_id": null,
  "submitted_sha256": null,
  "evidence": null,
  "conflict": null
}
